{
  "schemaVersion": "chromalab.benchmark.stage123_parity_record.v1",
  "recordId": "stage123_bench_04_stacked_xic_resolution_pc_stage2_graph_discovery_candidate_v1",
  "fixtureId": "bench_04_stacked_xic_resolution",
  "mode": "pc_prototype",
  "sourceId": "r5_stage2_graph_discovery_candidate_v1",
  "sourceKind": "PC_STAGE2_GRAPH_DISCOVERY_CANDIDATE",
  "productionImpact": "NONE_SHADOW_ONLY",
  "runtimeReadiness": "PC_STAGE2_GRAPH_DISCOVERY_CANDIDATE_NOT_RUNTIME_READY",
  "expectedGraphCount": 4,
  "detectedGraphCount": 4,
  "graphCountScore": "PASS",
  "expectedLayoutClass": "MULTI_PANEL_SEPARATE_AXES",
  "predictedLayoutClass": "UNKNOWN_REVIEW",
  "layoutClassScore": "NOT_SCOREABLE",
  "imagePreparation": {
    "status": "REVIEW",
    "available": true,
    "summary": "Uses R4 Rust Stage 1 selected preprocessing evidence as the upstream image-preparation input.",
    "metrics": {
      "r4SelectedVariantScore": 0.291649,
      "r4SelectedVariantParity": true,
      "r4StatusParity": true
    }
  },
  "graphDiscovery": {
    "status": "REVIEW",
    "available": true,
    "summary": "Detects graph count from deterministic row-axis projection candidates, with rejected giant/title/page bands preserved as evidence.",
    "metrics": {
      "expectedGraphCount": 4,
      "detectedGraphCount": 4,
      "rowCandidateCount": 8,
      "selectedRowCount": 4,
      "rejectedRowCandidateCount": 0,
      "threshold": 185.0,
      "contentCropX": 0,
      "contentCropY": 0,
      "contentCropWidth": 534,
      "contentCropHeight": 1110
    }
  },
  "plotAreaLayout": {
    "status": "NOT_SCORED",
    "available": false,
    "summary": "R5 is Stage 2 graph discovery only; plotArea and semantic layout remain Stage 3 work."
  },
  "failureClass": "",
  "firstFailingStage": "",
  "evidence": {
    "sourceImage": "composeApp/src/androidMain/assets/validation/bench_04_stacked_xic_resolution.png",
    "recordSource": "benchmark/reports/r5_stage2_graph_discovery_candidate/summary.json",
    "artifactPaths": [
      "benchmark/reports/r5_stage2_graph_discovery_candidate/overlays/bench_04_stacked_xic_resolution_graph_discovery_overlay.png",
      "benchmark/reports/r4_rust_stage1_image_preparation_parity/rust_reports/bench_04_stacked_xic_resolution_rust_stage1_report.json"
    ]
  },
  "promotionDecision": "STAGE2_CANDIDATE_REQUIRES_STAGE3_PARITY",
  "notes": [
    "Shadow-only Stage 2 graph discovery candidate.",
    "No plotArea, calibration, trace, peak, report-gate, or CalculationEngine authority.",
    "Graph count is scored, but graphPanel localization is candidate-only until Stage 3 IoU/plotArea scoring.",
    "Layout class is intentionally NOT_SCOREABLE in R5."
  ]
}
