{
  "schemaVersion": "chromalab.benchmark.stage123_parity_record.v1",
  "recordId": "stage123_bench_01_mz71_screenshot_page_annotation_upper_bound_geometry_only_panel_count_v1",
  "fixtureId": "bench_01_mz71_screenshot_page",
  "mode": "annotation_upper_bound",
  "sourceId": "geometry_only_panel_count_v1",
  "sourceKind": "ANNOTATION_UPPER_BOUND",
  "productionImpact": "NONE_SHADOW_ONLY",
  "runtimeReadiness": "PROTOTYPE_GEOMETRY_ONLY",
  "expectedGraphCount": 2,
  "detectedGraphCount": 2,
  "graphCountScore": "PASS",
  "expectedLayoutClass": "MULTI_PANEL_SEPARATE_AXES",
  "predictedLayoutClass": "MULTI_PANEL_SEPARATE_AXES",
  "layoutClassScore": "PASS",
  "imagePreparation": {
    "status": "NOT_SCORED",
    "available": false,
    "summary": "DR-C7 uses annotation-derived semantic/page context and does not produce Stage 1 image-prep evidence."
  },
  "graphDiscovery": {
    "status": "PASS",
    "available": true,
    "summary": "Graph count inherited from DR-C6 graph-row evidence.",
    "metrics": {
      "expectedGraphCount": 2,
      "detectedGraphCount": 2
    }
  },
  "plotAreaLayout": {
    "status": "PASS",
    "available": true,
    "summary": "Annotation upper-bound layout classification; requires automatic OCR/page-context extraction before runtime use."
  },
  "failureClass": "",
  "firstFailingStage": "",
  "evidence": {
    "sourceImage": "validation/bench_01_mz71_screenshot_page.jpg",
    "recordSource": "benchmark/reports/drc7_panel_semantic_classifier/summary.json",
    "artifactPaths": []
  },
  "promotionDecision": "DO_NOT_PROMOTE_UPPER_BOUND_ONLY",
  "notes": [
    "Geometry detected multiple graph rows but no semantic panel type.",
    "Upper-bound result only; not automatic runtime evidence."
  ]
}
