{
  "schemaVersion": "chromalab.benchmark.stage123_parity_record.v1",
  "recordId": "stage123_bench_05_tic_plus_ions_annotation_upper_bound_annotation_text_role_panel_family_v1",
  "fixtureId": "bench_05_tic_plus_ions",
  "mode": "annotation_upper_bound",
  "sourceId": "annotation_text_role_panel_family_v1",
  "sourceKind": "ANNOTATION_UPPER_BOUND",
  "productionImpact": "NONE_SHADOW_ONLY",
  "runtimeReadiness": "UPPER_BOUND_REQUIRES_AUTOMATIC_OCR_TEXT_ROLE_EXTRACTION",
  "expectedGraphCount": 4,
  "detectedGraphCount": 4,
  "graphCountScore": "PASS",
  "expectedLayoutClass": "TIC_PLUS_ION_PANELS",
  "predictedLayoutClass": "TIC_PLUS_ION_PANELS",
  "layoutClassScore": "PASS",
  "imagePreparation": {
    "status": "NOT_SCORED",
    "available": false,
    "summary": "DR-C7 uses annotation-derived semantic/page context and does not produce Stage 1 image-prep evidence."
  },
  "graphDiscovery": {
    "status": "PASS",
    "available": true,
    "summary": "Graph count inherited from DR-C6 graph-row evidence.",
    "metrics": {
      "expectedGraphCount": 4,
      "detectedGraphCount": 4
    }
  },
  "plotAreaLayout": {
    "status": "PASS",
    "available": true,
    "summary": "Annotation upper-bound layout classification; requires automatic OCR/page-context extraction before runtime use."
  },
  "failureClass": "",
  "firstFailingStage": "",
  "evidence": {
    "sourceImage": "validation/bench_05_tic_plus_ions.png",
    "recordSource": "benchmark/reports/drc7_panel_semantic_classifier/summary.json",
    "artifactPaths": []
  },
  "promotionDecision": "DO_NOT_PROMOTE_UPPER_BOUND_ONLY",
  "notes": [
    "Text roles expose a TIC panel plus ion/mz panels.",
    "Upper-bound result only; not automatic runtime evidence."
  ]
}
