{
  "schemaVersion": "chromalab.benchmark.stage123_parity_record.v1",
  "recordId": "stage123_bench_01_mz71_screenshot_page_deterministic_android_phase9j_current",
  "caseId": "phase9j_bench_01_mz71_screenshot_page_deterministic",
  "runId": "bench_01_mz71_screenshot_page_20260526_184458",
  "fixtureId": "bench_01_mz71_screenshot_page",
  "mode": "deterministic",
  "sourceId": "android_phase9j_current",
  "sourceKind": "ACTIVE_ANDROID_BASELINE",
  "productionImpact": "NONE_SHADOW_ONLY",
  "runtimeReadiness": "ACTIVE_RUNTIME_RECORDED_OUTPUT",
  "expectedGraphCount": 2,
  "detectedGraphCount": 1,
  "graphCountScore": "FAIL",
  "expectedLayoutClass": "MULTI_PANEL_SEPARATE_AXES",
  "predictedLayoutClass": "UNKNOWN_REVIEW",
  "layoutClassScore": "MISSING",
  "imagePreparation": {
    "status": "NOT_RECORDED",
    "available": false,
    "summary": "Phase 9J benchmark records do not lock normalized-image hash, dimensions, orientation, or preprocessing variant.",
    "metrics": {
      "truthGap": "input_image_hash"
    }
  },
  "graphDiscovery": {
    "status": "REVIEW",
    "available": true,
    "summary": "Active Android baseline graph-panel stage from Phase 9J records.",
    "metrics": {
      "expectedGraphCount": 2,
      "detectedGraphCount": 1,
      "graphCountMatches": false
    }
  },
  "plotAreaLayout": {
    "status": "VALID",
    "available": true,
    "summary": "PlotArea/layout status from normalized Phase 9J prediction record.",
    "metrics": {
      "graphPanelStatus": "VALID",
      "plotAreaStatus": "VALID"
    }
  },
  "failureClass": "TICK_LOCALIZATION_FAILURE",
  "firstFailingStage": "Y_CALIBRATION",
  "evidence": {
    "sourceImage": "validation/bench_01_mz71_screenshot_page.jpg",
    "recordSource": "benchmark/examples/phase9j_truth_audit/phase9j_bench_01_mz71_screenshot_page_deterministic/prediction.json",
    "artifactPaths": [
      "artifacts/phase9i-final-android/bench_01_mz71_screenshot_page/deterministic/bench_01_mz71_screenshot_page_20260526_184458/runtime_evidence_package_bench_01_mz71_screenshot_page_20260526_184458.json",
      "artifacts/phase9i-final-android/bench_01_mz71_screenshot_page/deterministic/bench_01_mz71_screenshot_page_20260526_184458/runtime_evidence_validation_bench_01_mz71_screenshot_page_20260526_184458.json",
      "artifacts/phase9i-final-android/bench_01_mz71_screenshot_page/deterministic/bench_01_mz71_screenshot_page_20260526_184458/runtime_evidence_validation_bench_01_mz71_screenshot_page_20260526_184458.md",
      "artifacts/phase9i-final-android/bench_01_mz71_screenshot_page/deterministic/bench_01_mz71_screenshot_page_20260526_184458/final_report_contract_bench_01_mz71_screenshot_page_20260526_184458.json",
      "artifacts/phase9i-final-android/bench_01_mz71_screenshot_page/deterministic/bench_01_mz71_screenshot_page_20260526_184458/report_bench_01_mz71_screenshot_page_20260526_184458.html",
      "artifacts/phase9i-final-android/bench_01_mz71_screenshot_page/deterministic/bench_01_mz71_screenshot_page_20260526_184458/report_bench_01_mz71_screenshot_page_20260526_184458.md"
    ]
  },
  "promotionDecision": "BASELINE_RECORD_ONLY",
  "notes": [
    "This is the current active Android baseline record.",
    "It is not a replacement candidate."
  ]
}
