{
  "schemaVersion": "chromalab.benchmark.stage123_parity_record.v1",
  "recordId": "stage123_bench_06_photo_two_graphs_page_deterministic_android_phase9j_current",
  "caseId": "phase9j_bench_06_photo_two_graphs_page_deterministic",
  "runId": "bench_06_photo_two_graphs_page_20260526_185549",
  "fixtureId": "bench_06_photo_two_graphs_page",
  "mode": "deterministic",
  "sourceId": "android_phase9j_current",
  "sourceKind": "ACTIVE_ANDROID_BASELINE",
  "productionImpact": "NONE_SHADOW_ONLY",
  "runtimeReadiness": "ACTIVE_RUNTIME_RECORDED_OUTPUT",
  "expectedGraphCount": 2,
  "detectedGraphCount": 1,
  "graphCountScore": "FAIL",
  "expectedLayoutClass": "TWO_GRAPH_PAGE",
  "predictedLayoutClass": "DENSE_PEAK_SINGLE_AXIS",
  "layoutClassScore": "FAIL",
  "imagePreparation": {
    "status": "NOT_RECORDED",
    "available": false,
    "summary": "Phase 9J benchmark records do not lock normalized-image hash, dimensions, orientation, or preprocessing variant.",
    "metrics": {
      "truthGap": "input_image_hash"
    }
  },
  "graphDiscovery": {
    "status": "REVIEW",
    "available": true,
    "summary": "Active Android baseline graph-panel stage from Phase 9J records.",
    "metrics": {
      "expectedGraphCount": 2,
      "detectedGraphCount": 1,
      "graphCountMatches": false
    }
  },
  "plotAreaLayout": {
    "status": "VALID",
    "available": true,
    "summary": "PlotArea/layout status from normalized Phase 9J prediction record.",
    "metrics": {
      "graphPanelStatus": "VALID",
      "plotAreaStatus": "VALID"
    }
  },
  "failureClass": "VLM_SEMANTIC_LAYER_UNAVAILABLE",
  "firstFailingStage": "",
  "evidence": {
    "sourceImage": "validation/bench_06_photo_two_graphs_page.jpg",
    "recordSource": "benchmark/examples/phase9j_truth_audit/phase9j_bench_06_photo_two_graphs_page_deterministic/prediction.json",
    "artifactPaths": [
      "artifacts/phase9i-final-android/bench_06_photo_two_graphs_page/deterministic/bench_06_photo_two_graphs_page_20260526_185549/runtime_evidence_package_run_1779811067085.json",
      "artifacts/phase9i-final-android/bench_06_photo_two_graphs_page/deterministic/bench_06_photo_two_graphs_page_20260526_185549/runtime_evidence_validation_run_1779811067085.json",
      "artifacts/phase9i-final-android/bench_06_photo_two_graphs_page/deterministic/bench_06_photo_two_graphs_page_20260526_185549/runtime_evidence_validation_run_1779811067085.md",
      "artifacts/phase9i-final-android/bench_06_photo_two_graphs_page/deterministic/bench_06_photo_two_graphs_page_20260526_185549/final_report_contract_run_1779811067085.json",
      "artifacts/phase9i-final-android/bench_06_photo_two_graphs_page/deterministic/bench_06_photo_two_graphs_page_20260526_185549/report_run_1779811067085.html",
      "artifacts/phase9i-final-android/bench_06_photo_two_graphs_page/deterministic/bench_06_photo_two_graphs_page_20260526_185549/report_run_1779811067085.md",
      "artifacts/phase9i-final-android/bench_06_photo_two_graphs_page/deterministic/bench_06_photo_two_graphs_page_20260526_185549/graph_1_graph_panel_overlay.png",
      "artifacts/phase9i-final-android/bench_06_photo_two_graphs_page/deterministic/bench_06_photo_two_graphs_page_20260526_185549/graph_1_plot_area_overlay.png",
      "artifacts/phase9i-final-android/bench_06_photo_two_graphs_page/deterministic/bench_06_photo_two_graphs_page_20260526_185549/graph_1_axis_tick_overlay.png",
      "artifacts/phase9i-final-android/bench_06_photo_two_graphs_page/deterministic/bench_06_photo_two_graphs_page_20260526_185549/graph_1_trace_overlay.png",
      "artifacts/phase9i-final-android/bench_06_photo_two_graphs_page/deterministic/bench_06_photo_two_graphs_page_20260526_185549/graph_1_peak_overlay.png"
    ]
  },
  "promotionDecision": "BASELINE_RECORD_ONLY",
  "notes": [
    "This is the current active Android baseline record.",
    "It is not a replacement candidate."
  ]
}
